[
  {
    "rule_id": "LMPC-R6-1A-RESPONSIBLE-PARTY",
    "version": "2026-07-01",
    "source_document": "DCA-OUTER-RETAIL-2023",
    "source_url": "https://consumeraffairs.gov.in/public/upload/admin/cmsfiles/whatsnews/Declaration_of_mandatory_information_on_the_outer_retail_package_-_reg._whatsnews.pdf",
    "rule_reference": "Rule 6(1)(a)",
    "requirement": "Declare the name and address of the manufacturer, packer, or importer as applicable.",
    "applicability": {"package_contexts": ["retail_prepackaged"]},
    "required_evidence": ["responsible_party_name", "responsible_party_address"],
    "validation_type": "presence",
    "minimum_confidence": 0.75,
    "severity": "high",
    "effective_date": "2026-07-01",
    "end_date": null,
    "explanation": "Identity and address evidence remain separate fields so partial detection is not treated as full compliance."
  },
  {
    "rule_id": "LMPC-R6-1B-COUNTRY-OF-ORIGIN",
    "version": "2026-07-01",
    "source_document": "DCA-OUTER-RETAIL-2023",
    "source_url": "https://consumeraffairs.gov.in/public/upload/admin/cmsfiles/whatsnews/Declaration_of_mandatory_information_on_the_outer_retail_package_-_reg._whatsnews.pdf",
    "rule_reference": "Rule 6(1)(a), imported products (country of origin)",
    "requirement": "Declare the country of origin or manufacture for an imported product.",
    "applicability": {"package_contexts": ["retail_prepackaged"], "origins": ["imported"]},
    "required_evidence": ["country_of_origin"],
    "validation_type": "presence",
    "minimum_confidence": 0.75,
    "severity": "high",
    "effective_date": "2026-07-01",
    "end_date": null,
    "explanation": "Domestic origin makes this check not applicable; unknown origin produces REVIEW rather than a violation."
  },
  {
    "rule_id": "LMPC-R6-1B-COMMODITY-NAME",
    "version": "2026-07-01",
    "source_document": "DCA-OUTER-RETAIL-2023",
    "source_url": "https://consumeraffairs.gov.in/public/upload/admin/cmsfiles/whatsnews/Declaration_of_mandatory_information_on_the_outer_retail_package_-_reg._whatsnews.pdf",
    "rule_reference": "Rule 6(1)(b)",
    "requirement": "Declare the common or generic name of the commodity.",
    "applicability": {"package_contexts": ["retail_prepackaged"]},
    "required_evidence": ["commodity_name"],
    "validation_type": "presence",
    "minimum_confidence": 0.7,
    "severity": "high",
    "effective_date": "2026-07-01",
    "end_date": null,
    "explanation": "Brand or marketing text should not silently substitute for a common or generic commodity name."
  },
  {
    "rule_id": "LMPC-R6-1C-NET-QUANTITY",
    "version": "2026-07-01",
    "source_document": "DCA-OUTER-RETAIL-2023",
    "source_url": "https://consumeraffairs.gov.in/public/upload/admin/cmsfiles/whatsnews/Declaration_of_mandatory_information_on_the_outer_retail_package_-_reg._whatsnews.pdf",
    "rule_reference": "Rule 6(1)(c)",
    "requirement": "Declare net quantity in a standard unit of weight, measure, or number.",
    "applicability": {"package_contexts": ["retail_prepackaged"]},
    "required_evidence": ["net_quantity"],
    "validation_type": "presence_format",
    "validation_config": {"format": "net_quantity"},
    "minimum_confidence": 0.75,
    "severity": "high",
    "effective_date": "2026-07-01",
    "end_date": null,
    "explanation": "The first pass screens for a numeric quantity and a recognized unit; detailed quantity verification is a later calibrated workflow."
  },
  {
    "rule_id": "LMPC-R6-1D-DATE",
    "version": "2026-07-01",
    "source_document": "DCA-OUTER-RETAIL-2023",
    "source_url": "https://consumeraffairs.gov.in/public/upload/admin/cmsfiles/whatsnews/Declaration_of_mandatory_information_on_the_outer_retail_package_-_reg._whatsnews.pdf",
    "rule_reference": "Rule 6(1)(d)",
    "requirement": "Declare the applicable month and year of manufacture, pre-packing, or import.",
    "applicability": {"package_contexts": ["retail_prepackaged"], "required_conditions": ["date_declaration_required"]},
    "required_evidence": ["manufacture_pack_import_date"],
    "validation_type": "presence_format",
    "validation_config": {"format": "month_year"},
    "minimum_confidence": 0.75,
    "severity": "medium",
    "effective_date": "2026-07-01",
    "end_date": null,
    "explanation": "Exceptions and commodity-specific date regimes must be resolved before this rule is treated as applicable."
  },
  {
    "rule_id": "LMPC-R6-1DA-BEST-BEFORE",
    "version": "2026-07-01",
    "source_document": "DCA-OUTER-RETAIL-2023",
    "source_url": "https://consumeraffairs.gov.in/public/upload/admin/cmsfiles/whatsnews/Declaration_of_mandatory_information_on_the_outer_retail_package_-_reg._whatsnews.pdf",
    "rule_reference": "Rule 6(1)(da), subject to other-law proviso",
    "requirement": "Declare best-before or use-by information where the commodity may become unfit for human consumption.",
    "applicability": {"package_contexts": ["retail_prepackaged"], "required_conditions": ["may_become_unfit_for_human_consumption"]},
    "required_evidence": ["best_before_or_use_by"],
    "validation_type": "presence",
    "minimum_confidence": 0.75,
    "severity": "high",
    "effective_date": "2026-07-01",
    "end_date": null,
    "explanation": "This conditional rule is never applied merely because a product was categorized as food or beverage."
  },
  {
    "rule_id": "LMPC-R6-1E-MRP",
    "version": "2026-07-01",
    "source_document": "DCA-OUTER-RETAIL-2023",
    "source_url": "https://consumeraffairs.gov.in/public/upload/admin/cmsfiles/whatsnews/Declaration_of_mandatory_information_on_the_outer_retail_package_-_reg._whatsnews.pdf",
    "rule_reference": "Rule 6(1)(e)",
    "requirement": "Declare the retail sale price as maximum retail price inclusive of all taxes.",
    "applicability": {"package_contexts": ["retail_prepackaged"]},
    "required_evidence": ["mrp"],
    "validation_type": "presence_format",
    "validation_config": {"format": "mrp"},
    "minimum_confidence": 0.75,
    "severity": "high",
    "effective_date": "2026-07-01",
    "end_date": null,
    "explanation": "The evidence should contain an MRP/maximum retail price indicator, a numeric amount, and inclusive-tax wording; uncertain OCR returns REVIEW."
  },
  {
    "rule_id": "LMPC-R6-2-CONSUMER-CARE",
    "version": "2026-07-01",
    "source_document": "DCA-OUTER-RETAIL-2023",
    "source_url": "https://consumeraffairs.gov.in/public/upload/admin/cmsfiles/whatsnews/Declaration_of_mandatory_information_on_the_outer_retail_package_-_reg._whatsnews.pdf",
    "rule_reference": "Rule 6(2)",
    "requirement": "Declare consumer-care contact information.",
    "applicability": {"package_contexts": ["retail_prepackaged"]},
    "required_evidence": ["consumer_care"],
    "validation_type": "presence",
    "minimum_confidence": 0.7,
    "severity": "medium",
    "effective_date": "2026-07-01",
    "end_date": null,
    "explanation": "If the consumer-care panel may be outside supplied images, non-detection remains REVIEW."
  },
  {
    "rule_id": "LMPC-R6-11-UNIT-SALE-PRICE",
    "version": "2026-07-01",
    "source_document": "GSR-226E-2022",
    "source_url": "https://consumeraffairs.gov.in/public/upload/files/GSR226_1732871458.pdf",
    "rule_reference": "Rule 6(11), substituted by G.S.R. 226(E)",
    "requirement": "Declare unit sale price in rupees, rounded as prescribed, per the applicable unit of weight, length, volume, number, or unit.",
    "applicability": {"package_contexts": ["retail_prepackaged"], "required_conditions": ["unit_sale_price_required"]},
    "required_evidence": ["unit_sale_price"],
    "validation_type": "presence_format",
    "validation_config": {"format": "unit_sale_price"},
    "minimum_confidence": 0.75,
    "severity": "medium",
    "effective_date": "2026-07-01",
    "end_date": null,
    "explanation": "Applicability must account for the provisos, including the MRP-equals-unit-sale-price case; unresolved cases remain REVIEW."
  },
  {
    "rule_id": "LMPC-R24-WHOLESALE-IDENTITY",
    "version": "2026-07-01",
    "source_document": "LMPC-CONSOLIDATED-2021",
    "source_url": "https://consumeraffairs.gov.in/public/upload/admin/cmsfiles/whatsnews/Book_on_Legal_Metrology_Packaged_Commodities_Rules%2C2011_with_all_amendments_whatsnews.pdf",
    "rule_reference": "Rule 24(a)",
    "requirement": "A wholesale package must declare the applicable manufacturer, importer, or packer name and address.",
    "applicability": {"package_contexts": ["wholesale"]},
    "required_evidence": ["responsible_party_name", "responsible_party_address"],
    "validation_type": "presence",
    "minimum_confidence": 0.75,
    "severity": "high",
    "effective_date": "2026-07-01",
    "end_date": null,
    "explanation": "Wholesale declarations are evaluated separately from Chapter II retail-package rules."
  },
  {
    "rule_id": "LMPC-R24-WHOLESALE-COMMODITY",
    "version": "2026-07-01",
    "source_document": "LMPC-CONSOLIDATED-2021",
    "source_url": "https://consumeraffairs.gov.in/public/upload/admin/cmsfiles/whatsnews/Book_on_Legal_Metrology_Packaged_Commodities_Rules%2C2011_with_all_amendments_whatsnews.pdf",
    "rule_reference": "Rule 24(b)",
    "requirement": "A wholesale package must declare the identity of the commodity.",
    "applicability": {"package_contexts": ["wholesale"]},
    "required_evidence": ["commodity_name"],
    "validation_type": "presence",
    "minimum_confidence": 0.7,
    "severity": "high",
    "effective_date": "2026-07-01",
    "end_date": null,
    "explanation": "This rule is not replaced by the retail-package MRP requirement."
  },
  {
    "rule_id": "LMPC-R24-WHOLESALE-QUANTITY",
    "version": "2026-07-01",
    "source_document": "LMPC-CONSOLIDATED-2021",
    "source_url": "https://consumeraffairs.gov.in/public/upload/admin/cmsfiles/whatsnews/Book_on_Legal_Metrology_Packaged_Commodities_Rules%2C2011_with_all_amendments_whatsnews.pdf",